SeneddID,CategoryCaption,CategoryID,EntryInRespectOf,EntrySubject
225,"2. Category 2: Remunerated employment, office, profession etc",2,Partner,Member of Parliament for Cardiff North (ceased)
225,"4. Category 4: Gifts, hospitality, material benefit or advantage",4,Member,Ticket and hospitality for self and guest at the Wales v. Estonia match on 8 September from the Football Association of Wales
225,"4. Category 4: Gifts, hospitality, material benefit or advantage",4,Member,Hospitality at Wales v. Australia rugby international from S4C.
225,6. Category 6: Financial sponsorship,6,Candidate,All my election expenses were met by Blaenau Gwent Constituency Labour Party.
225,8. Category 8: Land and property,8,Member,"Rental property, Aberystwyth"
225,11. Record of membership of societies,11,NA,President - Beaufort Male Choir
