SeneddID,CategoryCaption,CategoryID,EntryInRespectOf,EntrySubject
4787,"2. Category 2: Remunerated employment, office, profession etc",2,Member,"P.A & J Fox – Farming Business (SO 4.3 - Band 2 – between 5 and 20 hours per week). Business is in receipt of support
under the EU’s Common Agricultural Policy."
4787,"2. Category 2: Remunerated employment, office, profession etc",2,Member,"Councillor - Monmouthshire County Council (SO 4.3 - Band 2 - Between 5 hours and 20 hours per week). Whilst eligible to receive a county councillor salary, appropriate officers of the council have been informed that I wish to forgo any further salary since being elected to the Senedd, May 6th 2021 (ceased on 5 May 2022)"
4787,"2. Category 2: Remunerated employment, office, profession etc",2,Spouse,Spouse - Employed by Monmouthshire County Council within the SPLD Service working approx 28 hours a week. (ceased)
4787,"4. Category 4: Gifts, hospitality, material benefit or advantage",4,Member and spouse,Tickets and hospitality at the Welsh Grand National 2024 held at Chepstow Racecourse provided by Arena Racing Company.
4787,5. Category 5: Remuneration or other material benefit,5,Member,Remuneration for two days support to Wrexham County Borough Council as part of a WLGA team of peer support regarding planning issues. Total £724 plus mileage reimbursement of £216 received 18 December 2024.
4787,6. Category 6: Financial sponsorship,6,Member,2021 Election expenses were met by the Welsh Conservative Party via the Monmouth Conservative Association.
4787,6. Category 6: Financial sponsorship,6,.,-
4787,8. Category 8: Land and property,8,Member,Residential property in Bridgend owned by Member and used by family member.
4787,10. Category 10:Membership/Chairmanship of bodies in receipt of Senedd funds,10,Member,Subscribing member of the National Farmers Union
