SeneddID,CategoryCaption,CategoryID,EntryInRespectOf,EntrySubject
8579,"2. Category 2: Remunerated employment, office, profession etc",2,Spouse,"Communications Officer, Plaid Cymru"
8579,"2. Category 2: Remunerated employment, office, profession etc",2,Member,"Received £75 for one recording session for S4C's Dechrau Canu, Dechrau Canmol prgoramme as a member of a choir. This is not ongoing work - it was one session of approximately 5 hours (SO 4.3 -Band 1 - Less than 5 hours per week)"
8579,"4. Category 4: Gifts, hospitality, material benefit or advantage",4,Member,Ticket to the Wales v France rugby match to sing the anthem on the pitch before the game with CF1 choir on 11 Marcher 2022. Provided by the WRU through CF1 choir.
8579,"4. Category 4: Gifts, hospitality, material benefit or advantage",4,Member,Two tickets and hospitality to Dragons v Gloucester on 9 April 2022 from BT - guest was Member's support staff
8579,6. Category 6: Financial sponsorship,6,Candidate,All 2021 election costs were paid for by Plaid Cymru.
8579,7. Category 7: Overseas visits,7,Member,"26 May 2022 - Valencia, Spain - To participate in a four-day week summit alongside other politicians and experts - Paid for by the Vice-Ministry of Employment, Valencian Government."
8579,10. Category 10:Membership/Chairmanship of bodies in receipt of Senedd funds,10,Member,"Councillor and Member – Community Councillor for Trecenydd, Penyrheol and Energlyn (intending to stand down at the next election and has not received any financial benefit as a councillor since becoming a Member of the Senedd)."
